{
  "schemaVersion": "0.1.0",
  "requestedResolution": 2048,
  "actualCubeFaceSize": 2048,
  "actualErpWidth": 4096,
  "actualErpHeight": 2048,
  "method": "sixFaceWebglCpuErp",
  "supersampleScale": 1,
  "maxCubeMapTextureSize": null,
  "maxRenderbufferSize": null,
  "allocationProbe": "notRun",
  "pixelReadbackProbe": "notRun",
  "resizeReasonCode": null
}
